{
  "name": "PRL",
  "homepage": "https://www.prl.one/",
  "imageURI": "assets/protocols/prl/mascot.png",
  "chains": {
    "mainnet": {
      "auctionCreators": [
        "0xd7e86Bd77784217324b4E94AEDc68E5C8227EC2B"
      ],
      "bondCreators": [
        "0xd7e86Bd77784217324b4E94AEDc68E5C8227EC2B"
      ]
    },
    "goerli": {
      "auctionCreators": [
        "0xfD99d2d103b09F95c3dFc458F57178bF0CD587B1",
        "0xEDBcCA5DfD692bab7656Ab2D4F499B43fA26480B",
        "0xb1Cc73B1610863D51B5b8269b9162237e87679c3"
      ],
      "bondCreators": [
        "0xfD99d2d103b09F95c3dFc458F57178bF0CD587B1",
        "0xEDBcCA5DfD692bab7656Ab2D4F499B43fA26480B",
        "0xb1Cc73B1610863D51B5b8269b9162237e87679c3"
      ]
    }
  }
}